{
  "Comment": "Session functions in KNIX",
  "StartAt": "entryFunction",
  "AllowImmediateMessages": true,
  "States": {
    "entryFunction": {
      "Type": "Task",
      "Resource": "entryFunction",
      "PotentialNext": ["sessionFunction1", "sessionFunction2", "finalFunction", "telemetryHandler"],
      "End": true
    },
    "heartbeatHandler": {
      "Type": "Task",
      "Resource": "heartbeatHandler",
      "PotentialNext": ["healthChecker"]
    },
    "telemetryHandler": {
      "Type": "Task",
      "Resource": "telemetryHandler",
      "PotentialNext": ["finalFunction"]
    },
    "sessionFunction1": {
      "Type": "Task",
      "Resource": "sessionFunction1",
      "SessionFunction": true,
      "SessionFunctionParameters": {
          "heartbeat_method": "function",
          "heartbeat_function": "heartbeatHandler",
          "heartbeat_interval_ms": 15000
      },
      "Next": "finalFunction",
      "PotentialNext": ["telemetryHandler"]
    },
    "sessionFunction2": {
      "Type": "Task",
      "Resource": "sessionFunction2",
      "SessionFunction": true,
      "SessionFunctionParameters": {
          "heartbeat_method": "function",
          "heartbeat_function": "heartbeatHandler",
          "heartbeat_interval_ms": 15000
      },
      "Next": "finalFunction",
      "PotentialNext": ["telemetryHandler"]
    },
    "finalFunction": {
      "Type": "Task",
      "Resource": "finalFunction",
      "End": true
    }
  }
}

